Key,Item Type,Publication Year,Author,Title,Publication Title,ISSN,DOI,Url,Abstract Note,Date,Date Added,Pages,Issue,Volume,Journal Abbreviation,Language,Rights,Archive,Archive Location,Notes,Manual Tags
2ITF9CSP,journalArticle,2015,"Sanderson, Allen R.; Siegfried, John J.",The case for paying college athletes,Journal of Economic Perspectives,19447965,10.1257/jep.29.1.115,,"Big-time commercialized intercollegiate athletics has attracted considerable attention in recent years. Popularity of this uniquely American activity, measured by attendance, television ratings, or team revenues, has never been higher. At the same time, however, several highprofile scandals exposing unseemly behavior on the part of players, coaches, and even respected higher education institutions - as well as questions about the distribution of the enormous revenues pouring into university athletic departments - have marred the image of these college football and men's basketball programs. Currently there are several legal challenges to the National Collegiate Athletic Association (NCAA) and its member institutions that may change dramatically and permanently the arrangements between the NCAA cartel, its member colleges and universities, and the ""studentathletes"" who play on the teams. These challenges all focus on the NCAA's collective fixing of players' wages. We describe this peculiar ""industry,"" detailing the numerous market imperfections in both output and labor markets, the demand for and supply of college athlete labor, and possible alternative arrangements in the college athlete labor market, including the ramifications of compensating players beyond the tuition, room, board, books, and fees that some current players already receive as grantsinaid.",12/1/15,9/29/25 19:28,115-138,1,29,,,,,,,
9WXAYTGZ,journalArticle,2022,"Martinez, Aja Y.",The Catharsis for Poison: A Counterstory Retrospective on Composition Studies' 50th Anniversary.,Composition Studies,,,https://research.ebsco.com/linkprocessor/plink?id=e095e84a-3c97-3f96-9d2e-332ed8c501d6,"The article discusses the Counter story ""The Catharsis for Poison: A Counter story Retrospective"" published in the Composition Studies periodical. It presents how the author works on the projects, where she gets the inspiration and her interest in scholars working on rhetoric and writing studies. It describes her Critical race theory (CRT) discussion concerning the methodology of this project.",2022,9/29/25 19:28,,1,50,Composition Studies,,,,,,Creative ability; Critical literacy; Critical race theory; Periodical articles; Rhetoric in literature
UNMEB4FL,journalArticle,2023,"Rodgers, Selena T.; Bayne, Gillian U.; Archimandritis, Jason",The Color of Education: Discriminación Y Comportamientos,Journal of Latinos and Education,1534-8431; 1532-771X,,https://research.ebsco.com/linkprocessor/plink?id=330e672e-24b3-397f-9881-08b295fcc733,"Discrimination is overwhelming immigrant communities across the U.S.A. and impacting educational outcomes and the fragmentation of families. This article employs intersectionality and Latina/o critical theory (LatCrit) as its theoretical framework to analyze education and the institution of familismo as a counterweight to anti-Latinx discrimination. Specifically, we investigate the relative importance of feeling discriminated against, family composition (dual-parent), and demographic variables (family composition, urbanicity – whether or not the student attends school in a city – region, SES, nativity) affect academic behavior for a national sample of Latinx students. Utilizing the National Center for Educational Statistics (NCES) High School Longitudinal Study (HSLS), we employed hierarchical regression modeling and found (1) that for females two-parent households had no effect on academic behavior when demographic variables were held constant; and (2) for males, those in household",2023,9/29/25 19:27,1223-1235,3,22,,,,,,,Academic Achievement; Barriers; Critical Theory; Educational Discrimination; Family Structure; Gender Differences; Hispanic American Students; Immigrants; Intersectionality; Social Discrimination; Socioeconomic Status
Y3ZRGSSI,journalArticle,2025,"Ortega, G. and Grafnetterova, N.",The community college athletic pathway: An examination of community college athletes to NCAA Division I institutions,Community College Review,,10.1177/00915521251322522,,,2025,9/29/25 19:28,134-156,2,53,Community College Review,,,,,,ABDC; CCW; Finance/Legacy; Systems Thinking
DI8E7HU3,journalArticle,2025,"HINTON, KAAVONIA; CHANDLER, KAREN","The Continuing, Resistant Popularity of Critical Race Theory--Informed Pedagogy.",English Journal,,10.58680/ej2025114424,https://research.ebsco.com/linkprocessor/plink?id=a9d4d7a5-a05f-3476-b17e-eef82ed25a09,"The article focuses on the ongoing commitment of educators to incorporate critical race theory (CRT)–informed pedagogy in English classrooms despite legislative efforts to suppress it. Topics include the historical and political context of anti-CRT policies, the personal and professional responses of educators to these restrictions, and student-centered strategies used to navigate and resist such limitations in meaningful and legally cautious ways.",2025,9/29/25 19:28,,4,114,English Journal,,,,,,Classrooms; Critical race theory; Critical theory; Educators; Teaching
IHMWNAYG,journalArticle,2022,"Diggs, Schnequa N.",The delusion of privilege.,Administrative Theory & Praxis (Taylor & Francis Ltd),,10.1080/10841806.2021.1984102,https://research.ebsco.com/linkprocessor/plink?id=c670ba3e-c169-30f2-aefc-5445a15a352a,"Using critical race theory (CRT), this article examines the ideology of privilege within White supremacy thought permeating the Administrative State. Through systems of privilege, the experiences of disadvantaged groups are masked by dominant narratives and used to validate status quo perspectives. To this point, privilege fuels the oppressive state of racial dominance, in American society, and is legitimized through the subtle language within the administrative practice.",2022,9/29/25 19:28,,2,44,Administrative Theory & Praxis (Taylor & Francis Ltd),,,,,,Critical race theory; Delusions; Ideology; White supremacy
HFZTBM96,journalArticle,2014,"Lusardi, Annamaria; Mitchell, Olivia S.",The economic importance of financial literacy: Theory and evidence,Journal of Economic Literature,220515,10.1257/jel.52.1.5,,"This paper undertakes an assessment of a rapidly growing body of economic research on financial literacy. We start with an overview of theoretical research, which casts financial knowledge as a form of investment in human capital. Endogenizing financial knowledge has important implications for welfare, as well as policies intended to enhance levels of financial knowledge in the larger population. Next, we draw on recent surveys to establish how much (or how little) people know and identify the least financially savvy population subgroups. This is followed by an examination of the impact of financial literacy on economic decision making in the United States and elsewhere. While the literature is still young, conclusions may be drawn about the effects and consequences of financial illiteracy and what works to remedy these gaps. A final section offers thoughts on what remains to be learned if researchers are to better inform theoretical and empirical models as well as public policy.",2014,9/29/25 19:27,May-44,1,52,,,,,,,ABDC; Behavioral Econ; Decision Intelligence; Finance/Legacy
EBDG66ZP,journalArticle,2022,"Arican, Hacer Ozge Baydar",The Effect of Altruistic Behaviors of Sports Sciences Faculty Students on the Decision of Forgiveness: A Structural Equality Model Investigation,International Education Studies,1913-9020,,https://research.ebsco.com/linkprocessor/plink?id=18c3ea3d-6730-31c0-a82e-47df1d142abc,"The purpose of the present study was to examine the effects of altruism behaviors on the forgiveness decision of athletes and sedentary students who continued education in the faculty of sports sciences with the Structural Equation Model. To this end, the Study Group consisted of a total of 200 athletes and sedentary students, 108 female and 92 male, who were selected with the Convenient Sampling Method, who continued education at Gazi University Faculty of Sport Sciences. When the distribution was examined according to gender, 58.5% of the sedentary group was female and 41.5% was male. The rate of women in the athlete group was 47.6%, and the rate of men was 52.4%. When the distribution was examined according to age groups, the rate of people in the 17-20 group in the sedentary group was 31.4%, the rate of people in the 21-24 age group was 55.9%, and the rate of people who were older than 25 was 12.7%. The rate of individuals who were aged 17-20 is 48.8% in the athlete group, the rat",2022,9/29/25 19:27,111-122,1,15,,,,,,,Altruism; Athletes; College Athletics; College Students; Foreign Countries; Gender Differences; Helping Relationship; Interpersonal Relationship; Life Style; Physical Activity Level; Student Behavior; Turkey; Volunteers
B8R5FF7Q,journalArticle,2023,"Curs, Bradley R.; Harper, Casandra E.; Frey, Charles; Wolak, Brandon",The Effect of College Football Bowl Game Participation on Student-Athlete Academic Outcomes and Team Athletic Success,Research in Higher Education,0361-0365; 1573-188X,,https://research.ebsco.com/linkprocessor/plink?id=075a8357-63b2-3f94-8b03-680647b809b9,"This study presents the results of a regression discontinuity empirical approach to investigate the effects of postseason bowl game participation on student-athlete academic outcomes and subsequent football team success. The practice expectations for student-athletes on football teams that participate in a bowl game increase by between two and four weeks relative to student-athletes on teams that do not participate in a bowl game. Prior research has been inconclusive on whether this increased practice intensity is associated with academic or athletic outcomes. The sample includes 130 NCAA football bowl subdivision (FBS) teams between the years 2003 through 2018. We apply a fuzzy regression discontinuity design by exploiting the fact that teams in the NCAA FBS become eligible to participate in a bowl game when their regular season winning percentage is greater than 0.50. The results suggest that bowl game participation increased the team's eligibility rate by 0.8 percentage points, the",2023,9/29/25 19:27,497-519,4,64,,,,,,,Academic Achievement; College Athletics; College Students; Eligibility; Student Athletes; Success; Team Sports
8R845FNY,journalArticle,2023,"Dyck, Bruno; Liao, Chi; Manchanda, Rajesh V.",The Effect of Teaching Multiple Approaches to Management on Students' Subsequent Investment Decisions: Implications for Responsible Management Education,Journal of Education for Business,0883-2323; 1940-3356,,https://research.ebsco.com/linkprocessor/plink?id=b4123519-eae5-320d-b474-0199f08d7aa4,"Responsible Management Education (RME) seeks to prepare students to address social and ecological crises via going beyond a traditional narrow understanding of shareholder wealth maximization. Past research has shown mixed results regarding the effectiveness of RME courses to change students' subsequent behavior. We examine whether taking an RME course that teaches multiple approaches to management affects students' subsequent investment decisions. We find that such students allocate less money to investments that focus only on financial returns without regard for social and ecological well-being, thereby counterbalancing our finding that greater investment knowledge is associated with allocating more money to such investments. Implications are discussed.",2023,9/29/25 19:27,359-366,7,98,,,,,,,Behavior Change; Business Administration Education; Decision Making; Ecology; Ethics; Instructional Effectiveness; Management Development; Marketing; Money Management; Resource Allocation; Social Problems; Teaching Methods; Undergraduate Students; Well Being
BPTYUNPM,journalArticle,1999,"Camerer, C. F. and Hogarth, R. M.",The effects of financial incentives in experiments: A review and capital-labor-production framework,Journal of Risk and Uncertainty,,10.1023/A:1007850605129,,,1999,9/29/25 19:28,Jul-42,3-Jan,19,Journal of Risk and Uncertainty,,,,,,ABDC; Behavioral Economics; Decision Intelligence; Finance/Contracts
8PDJVVBM,journalArticle,2025,"Tabahi, Suhad; Villarreal Sosa, Leticia",The imperative of critical race theory in social work education amid political threats.,Social Work Education,,10.1080/02615479.2025.2555578,https://research.ebsco.com/linkprocessor/plink?id=4c07b746-90f6-3416-84ba-a69f0bcba62e,"The escalating attacks on Critical Race Theory (CRT) and Diversity, Equity, and Inclusion (DEI) in the United States (U.S.) threaten social work’s commitment to justice and equity. Rooted in a history that has centered white supremacy, the profession must actively challenge dominant narratives and push for the integration of CRT in social work education. Framing CRT within cultural humility moves the field beyond the limitations of cultural competency, fostering critical self-reflection, lifelong learning, and power-conscious practice. This paper argues that embracing CRT through a cultural humility lens is a necessary step in decolonizing the social work curriculum, resisting political intimidation, and equipping future practitioners to dismantle systemic oppression. Social work cannot afford neutrality—it must be an active force for change.",2025,9/29/25 19:28,,,,Social Work Education,,,,,,Critical race theory; Cultural humility; Diversity & inclusion policies; Diversity in education; Oppression; Other Individual and Family Services; Political opposition; Social justice; Social work education; United States
LULL59EC,journalArticle,2023,"Lusardi, Annamaria; Mitchell, Olivia S.",The Importance of Financial Literacy: Opening a New Field,Journal of Economic Perspectives,0895-3309,10.1257/jep.37.4.137,https://pubs.aeaweb.org/doi/10.1257/jep.37.4.137,"We undertake an assessment of our two decades of research on financial literacy, building on our empirical research and theoretical work casting financial knowledge as a form of investment in human capital. We also draw on recent data to determine who is the most—and least—financially savvy in the United States, and we highlight the similarity of our results in other countries. A number of convincing studies is now available, from which we draw conclusions about the effects and consequences of financial illiteracy, and what can be done to fill these gaps. We conclude by offering our thoughts on implications for teaching, policy, and future research.",11/1/23,9/15/25 18:31,137-154,4,37,Journal of Economic Perspectives,en,,,,,
3T3MWETZ,journalArticle,2024,"Rahmani, Midia; Majedi, Nima; Naderi Nasab, Mahdi",The Importance of Financial Support for Professional Athletes in Competitive Sports,Journal of Technology in Entrepreneurship and Strategic Management,3041-8585,,,"The objective of this review is to explore the importance of financial support for professional athletes in competitive sports. This article is a narrative review utilizing a descriptive analysis of existing literature on the subject of financial support in professional sports. Data sources included peer-reviewed articles, reports, and industry publications, focusing on studies that explore the role of sponsorships, financial models, and policy frameworks. Relevant findings were synthesized to provide a comprehensive analysis of the current state and future directions of athlete financial support. Financial support is critical for enhancing athlete performance and ensuring long-term career sustainability. Athletes who receive stable financial backing have better access to training, recovery, and mental health resources, allowing them to focus on their athletic development. However, disparities in financial support across different sports, genders, and regions remain significant challenges. Emerging models, such as fan-funded platforms and blockchain solutions, offer promising alternatives to traditional sponsorships, suggesting a more equitable future for athlete funding. The review concludes that while financial support is indispensable for athletes, the current system is marked by inequities. To promote fairness and sustainability in competitive sports, stakeholders must adopt innovative financial models and implement policies that ensure equal access to resources. Embracing these changes will lead to a more inclusive and supportive financial ecosystem for athletes globally.",7/1/24,9/29/25 19:27,70-87,3,3,,,,,,,athlete performance; career longevity; Financial support; professional athletes; sponsorship; sports funding
5LENZWKB,journalArticle,2024,"Syahwildan, Muhamad; Hidayah, Zulfa Zakiatul","The Influence of Financial Literacy, Self-Efficacy, and Coping Strategies on Students' Finances",Ilomata International Journal of Tax and Accounting,2714-9838,10.52728/ijtc.v5i1.1056,,"Students with financial behavior that tends to be consumptive have a negative impact on financial behavior, new experiences as students and employees with limited income and various expenses must be able to be managed properly to be able to produce good financial behavior. This study aims to determine the effect of financial literacy on financial management behavior and to analyze the psychological effect of Self-Efficacy and Self-Coping on financial management behavior of undergraduate students in the management study program at Pelita Bangsa University. The research method used is quantitative with data sources taken by distributing questionnaires. Sampling used is by simple random sampling method. The population in this study were all students of the management study program in 2022 with a total of 4995, with a sample of 98 respondents obtained from the Slovin formula. The results of the research tested with SmartPLS 3.0 show that financial literacy, self-efficacy, and self-coping have a significant effect on financial behavior.",1/23/24,9/29/25 19:27,254-265,1,5,,,,,,,
K5FDI3H3,journalArticle,2017,"Alase, Abayomi",The Interpretative Phenomenological Analysis (IPA): A Guide to a Good Qualitative Research Approach,International Journal of Education and Literacy Studies,2202-9478,10.7575/aiac.ijels.v.5n.2p.9,,"As a research methodology, qualitative research method infuses an added advantage to the exploratory capability that researchers need to explore and investigate their research studies. Qualitative methodology allows researchers to advance and apply their interpersonal and subjectivity skills to their research exploratory processes. However, in a study with an interpretative phenomenological analysis (IPA) approach, the advantageous elements of the study quadruple because of the bonding relationship that the approach allows for the researchers to develop with their research participants. Furthermore, as a qualitative research approach, IPA gives researchers the best opportunity to understand the innermost deliberation of the ‘lived experiences’ of research participants. As an approach that is ‘participant-oriented’, interpretative phenomenological analysis approach allows the interviewees (research participants) to express themselves and their ‘lived experience’ stories the way they see fit without any distortion and/or prosecution. Therefore, utilizing the IPA approach in a qualitative research study reiterates the fact that its main objective and essence are to explore the ‘lived experiences’ of the research participants and allow them to narrate the research findings through their ‘lived experiences’. As such, this paper discusses the historical background of phenomenology as both a theory and a qualitative research approach, an approach that has transitioned into an interpretative analytical tradition. Furthermore, as a resource tool to novice qualitative researchers, this paper provides a step-by-step comprehensive guide to help prepare and equip researchers with ways to utilize and apply the IPA approach in their qualitative research studies.  More importantly, this paper also provides an advanced in-depth analysis and usability application for the IPA approach in a qualitatively conducted research study. As such, this paper completely contrasted itself from many books and articles that are written with the premise of providing useful and in-depth information on the subject-matter (phenomenology, as a qualitative approach).",4/30/17,9/29/25 19:27,9,2,5,,,,,,,
SFGP34KP,journalArticle,2025,"Asamoah, K. & Byers, T.",The intersection of governance and social responsibility in sport: Re-conceptualizing fair play,Handbook on Corporate Social Responsibility in Sport,,10.4324/9781003469445-8,,Explores how governance and CSR shape athlete philanthropy and entrepreneurship in modern sport.,2025,9/29/25 19:28,,,,Handbook on Corporate Social Responsibility in Sport,,,,,,CCW; CRT; Philanthropy/Entrepreneurship
NHZ9SZYW,journalArticle,2025,"Jones, Veronica A.; Briscoe, Kaleb L.",The Legal Logic of Whiteness: A Critical Discourse Analysis of Policymakers’ Rhetoric in CRT Legislation.,Journal of Higher Education,,10.1080/00221546.2025.2550902,https://research.ebsco.com/linkprocessor/plink?id=2efec184-165c-3105-bdaa-6ba2283707bb,"Recent sociopolitical movements have reflected concerted efforts by policymakers to contest socially conscious curriculum, resulting in critical race theory (CRT) legislative bans across the country. CRT as an analytical lens allows scholars to show how policy can uphold the status quo while reinforcing whiteness in society. Anti-CRT legislation has centered on the idea of CRT as divisive, which led to our intentional focus of this study on the initial creation of these policies to analyze the arguments as linked to sociopolitical rhetoric. To this aim, we critically examined the rationales across 42 states and a total of 66 documents using a CRT framework, particularly whiteness as property. We employed the sociocognitive approach to critical discourse analysis (CDA) to reveal how power and racism are reproduced in legal logic, pointing to the relationship between discourse, cognition, and society. Our findings indicate the ways that policymakers invoked race neutrality through emotionality and sought curricular control through dominant norms such as impartiality, objectivity, and historical accuracy. We provide a significant contribution to the body of scholarship on legislative attacks in higher education by focusing on racism and white emotionality, which is reinforced in policy discourse and connected to current political resistance to change.",2025,9/29/25 19:28,,,,Journal of Higher Education,,,,,,Critical discourse analysis; Critical race theory; Cultural hegemony; Curriculum; Ideology; Legal reasoning; Racism; Rhetoric & politics
EV2MI4UG,journalArticle,2025,"Velema, T. A.",The Macro-Structure of Football’s Global Migration System,International Review for the Sociology of Sport,,10.1177/10126902251362222,,"Analyzes structural constraints on athlete migration across linguistic, geographic, and economic boundaries.",2025,9/29/25 19:28,,,,International Review for the Sociology of Sport,,,,,,CRT; Global Migration; Systems Thinking
TQC7RS2T,journalArticle,2025,"Hodge, Samuel R.; Howe, Jonathan E.; Bennett, Robert",The Meanings Black Male Student–Athletes Ascribe to Their Collegiate Experience Through Counterspace Participation,Quest,15432750,10.1080/00336297.2025.2470241,,"The purpose of this study was to explore the meanings Black male student–athletes ascribed to their involvement in the Redefining Athletic Standards student organization and to analyze interpretations of both the academic and athletic aspects of their collegiate experience. The research design was a multiple-case study. The participants were nine (9) Black male student–athletes at an NCAA Division I affiliated university. The sampling design was purposeful. The primary data sources were individual, face-to-face interviews and a focus group interview. The data were analyzed using constant comparative analysis. Two major interrelated themes emerged, which were as follows: (a) brotherhood in Redefining Athletic Standards and (b) it takes a village. The themes and implications from the study’s breath of findings are discussed.",2025-03,9/29/25 19:28,25-Jan,,,,,,,,,Athletic identity; racial consciousness; racism
